{
  "token_address": "0x1234567890abcdef1234567890abcdef12345678",
  "chain": "ethereum",
  "timestamp": "2024-01-15T10:30:00Z",
  "token_metadata": {
    "name": "MoonShot Token",
    "symbol": "MOON",
    "decimals": 18,
    "total_supply": "1000000000000000000000000",
    "contract_created_at": "2024-01-10T08:00:00Z"
  },
  "probability_heatmap": {
    "horizons": {
      "24h": {
        "2x": {
          "probability": 0.35,
          "confidence_interval": {
            "lower": 0.28,
            "upper": 0.42,
            "confidence_level": 0.95
          }
        },
        "5x": {
          "probability": 0.12,
          "confidence_interval": {
            "lower": 0.08,
            "upper": 0.16,
            "confidence_level": 0.95
          }
        },
        "10x": {
          "probability": 0.03,
          "confidence_interval": {
            "lower": 0.01,
            "upper": 0.05,
            "confidence_level": 0.95
          }
        },
        "20x": {
          "probability": 0.005,
          "confidence_interval": {
            "lower": 0.001,
            "upper": 0.01,
            "confidence_level": 0.95
          }
        },
        "50x": {
          "probability": 0.001,
          "confidence_interval": {
            "lower": 0.0,
            "upper": 0.003,
            "confidence_level": 0.95
          }
        }
      },
      "7d": {
        "2x": {
          "probability": 0.55,
          "confidence_interval": {
            "lower": 0.48,
            "upper": 0.62,
            "confidence_level": 0.95
          }
        },
        "5x": {
          "probability": 0.25,
          "confidence_interval": {
            "lower": 0.19,
            "upper": 0.31,
            "confidence_level": 0.95
          }
        },
        "10x": {
          "probability": 0.1,
          "confidence_interval": {
            "lower": 0.06,
            "upper": 0.14,
            "confidence_level": 0.95
          }
        },
        "20x": {
          "probability": 0.03,
          "confidence_interval": {
            "lower": 0.01,
            "upper": 0.05,
            "confidence_level": 0.95
          }
        },
        "50x": {
          "probability": 0.008,
          "confidence_interval": {
            "lower": 0.002,
            "upper": 0.014,
            "confidence_level": 0.95
          }
        }
      },
      "30d": {
        "2x": {
          "probability": 0.68,
          "confidence_interval": {
            "lower": 0.61,
            "upper": 0.75,
            "confidence_level": 0.95
          }
        },
        "5x": {
          "probability": 0.38,
          "confidence_interval": {
            "lower": 0.31,
            "upper": 0.45,
            "confidence_level": 0.95
          }
        },
        "10x": {
          "probability": 0.18,
          "confidence_interval": {
            "lower": 0.13,
            "upper": 0.23,
            "confidence_level": 0.95
          }
        },
        "20x": {
          "probability": 0.07,
          "confidence_interval": {
            "lower": 0.04,
            "upper": 0.1,
            "confidence_level": 0.95
          }
        },
        "50x": {
          "probability": 0.02,
          "confidence_interval": {
            "lower": 0.008,
            "upper": 0.032,
            "confidence_level": 0.95
          }
        }
      }
    }
  },
  "risk_score": {
    "composite_score": 45.5,
    "components": {
      "rug_risk": 30.0,
      "dev_risk": 50.0,
      "distribution_risk": 40.0,
      "social_manipulation_risk": 55.0,
      "liquidity_risk": 35.0
    },
    "risk_flags": [
      "high_dev_holding",
      "recent_dev_sell",
      "low_liquidity_depth",
      "suspicious_social_pattern"
    ]
  },
  "explanations": {
    "probability_2x_24h": {
      "top_features": [
        {
          "feature_name": "volume_momentum_1h",
          "contribution": 0.15,
          "direction": "positive",
          "description": "Strong positive volume momentum in last hour"
        },
        {
          "feature_name": "kol_mention_velocity",
          "contribution": 0.12,
          "direction": "positive",
          "description": "Accelerating mentions from key opinion leaders"
        },
        {
          "feature_name": "liquidity_depth_5pct",
          "contribution": -0.08,
          "direction": "negative",
          "description": "Low liquidity depth reduces probability"
        },
        {
          "feature_name": "holder_concentration",
          "contribution": -0.06,
          "direction": "negative",
          "description": "High concentration in top holders"
        },
        {
          "feature_name": "smart_money_activity",
          "contribution": 0.1,
          "direction": "positive",
          "description": "Detected smart money wallet activity"
        }
      ]
    },
    "probability_10x_7d": {
      "top_features": [
        {
          "feature_name": "social_sentiment_acceleration",
          "contribution": 0.18,
          "direction": "positive",
          "description": "Rapid positive sentiment shift"
        },
        {
          "feature_name": "similar_token_cluster_performance",
          "contribution": 0.14,
          "direction": "positive",
          "description": "Similar tokens have performed well"
        },
        {
          "feature_name": "dev_wallet_sells",
          "contribution": -0.12,
          "direction": "negative",
          "description": "Recent dev wallet selling activity"
        },
        {
          "feature_name": "holder_growth_velocity",
          "contribution": 0.09,
          "direction": "positive",
          "description": "Fast holder base expansion"
        },
        {
          "feature_name": "contract_age",
          "contribution": -0.05,
          "direction": "negative",
          "description": "Very new contract increases uncertainty"
        }
      ]
    },
    "risk_score": {
      "top_features": [
        {
          "feature_name": "dev_holding_percentage",
          "contribution": 0.2,
          "direction": "positive",
          "description": "Dev holds 25% of supply"
        },
        {
          "feature_name": "lp_lock_duration",
          "contribution": -0.15,
          "direction": "negative",
          "description": "LP locked for 90 days"
        },
        {
          "feature_name": "bot_trading_ratio",
          "contribution": 0.12,
          "direction": "positive",
          "description": "High proportion of bot trades"
        },
        {
          "feature_name": "social_authenticity_score",
          "contribution": -0.1,
          "direction": "negative",
          "description": "Relatively authentic social engagement"
        },
        {
          "feature_name": "holder_gini",
          "contribution": 0.08,
          "direction": "positive",
          "description": "Unequal holder distribution"
        }
      ]
    }
  },
  "features": {
    "token_features": {
      "market_cap": 2500000.0,
      "age_hours": 120.5,
      "volume_24h": 850000.0,
      "price_change_24h": 0.45,
      "is_paid_listing": true
    },
    "liquidity_features": {
      "total_liquidity_usd": 500000.0,
      "liquidity_depth_1pct": 125000.0,
      "liquidity_depth_5pct": 450000.0,
      "lp_locked": true,
      "lp_lock_expires_at": "2024-04-15T00:00:00Z"
    },
    "holder_features": {
      "total_holders": 2847,
      "holder_gini": 0.72,
      "top10_concentration": 0.58,
      "holder_growth_24h": 0.35
    },
    "social_features": {
      "mention_volume_24h": 1523,
      "mention_velocity_1h": 45.2,
      "sentiment_score": 0.62,
      "kol_mentions": 8
    },
    "dev_features": {
      "dev_holding_percentage": 0.25,
      "dev_sells_24h": 0.03,
      "contract_verified": true
    }
  },
  "timelines": {
    "liquidity_events": [
      {
        "timestamp": "2024-01-10T08:30:00Z",
        "event_type": "add",
        "amount_usd": 300000.0
      },
      {
        "timestamp": "2024-01-10T09:00:00Z",
        "event_type": "lock",
        "amount_usd": 300000.0
      },
      {
        "timestamp": "2024-01-12T14:20:00Z",
        "event_type": "add",
        "amount_usd": 200000.0
      }
    ],
    "social_mentions": [
      {
        "timestamp": "2024-01-14T00:00:00Z",
        "source": "twitter",
        "mention_count": 234,
        "sentiment": 0.55
      },
      {
        "timestamp": "2024-01-14T06:00:00Z",
        "source": "twitter",
        "mention_count": 456,
        "sentiment": 0.62
      },
      {
        "timestamp": "2024-01-14T12:00:00Z",
        "source": "twitter",
        "mention_count": 689,
        "sentiment": 0.68
      },
      {
        "timestamp": "2024-01-14T18:00:00Z",
        "source": "telegram",
        "mention_count": 144,
        "sentiment": 0.71
      }
    ],
    "dev_transfers": [
      {
        "timestamp": "2024-01-11T10:15:00Z",
        "from_address": "0xDEV1234567890abcdef1234567890abcdef1234",
        "to_address": "0xEXCHANGE567890abcdef1234567890abcdef56",
        "amount": "50000000000000000000000",
        "usd_value": 75000.0
      }
    ]
  },
  "top_holders": [
    {
      "address": "0xDEV1234567890abcdef1234567890abcdef1234",
      "balance": "250000000000000000000000",
      "percentage": 25.0,
      "is_contract": false,
      "flags": [
        "dev_wallet",
        "recent_seller"
      ]
    },
    {
      "address": "0xLIQPOOL67890abcdef1234567890abcdef6789",
      "balance": "200000000000000000000000",
      "percentage": 20.0,
      "is_contract": true,
      "flags": [
        "liquidity_pool",
        "locked"
      ]
    },
    {
      "address": "0xSMARTMONEY890abcdef1234567890abcdef890",
      "balance": "80000000000000000000000",
      "percentage": 8.0,
      "is_contract": false,
      "flags": [
        "smart_money",
        "early_buyer"
      ]
    },
    {